{
  "planogram_id": "demo_aisle",
  "name": "Demo snacks aisle",
  "source": "manual",
  "bays": [
    {
      "bay_id": "B1",
      "type": "shelf",
      "width_m": 1.2,
      "height_m": 1.8,
      "station": {
        "camera_pos": [
          0.0,
          1.5,
          2.2
        ],
        "look_at": [
          0.0,
          1.1,
          0.0
        ]
      },
      "shelves": [
        {
          "shelf_id": "B1S1",
          "height_m": 1.7,
          "level": "top",
          "slots": [
            {
              "slot_id": "B1S1P1",
              "sku_id": "SKU_001",
              "facings": 2,
              "x_m": 0.05,
              "width_m": 0.5,
              "height_m": 0.22
            },
            {
              "slot_id": "B1S1P2",
              "sku_id": "SKU_002",
              "facings": 3,
              "x_m": 0.6,
              "width_m": 0.5,
              "height_m": 0.22
            }
          ]
        },
        {
          "shelf_id": "B1S2",
          "height_m": 1.45,
          "level": "above_eye",
          "slots": [
            {
              "slot_id": "B1S2P1",
              "sku_id": "SKU_003",
              "facings": 3,
              "x_m": 0.05,
              "width_m": 0.5,
              "height_m": 0.22
            },
            {
              "slot_id": "B1S2P2",
              "sku_id": "SKU_004",
              "facings": 4,
              "x_m": 0.6,
              "width_m": 0.5,
              "height_m": 0.22
            }
          ]
        },
        {
          "shelf_id": "B1S3",
          "height_m": 1.2,
          "level": "eye",
          "slots": [
            {
              "slot_id": "B1S3P1",
              "sku_id": "SKU_005",
              "facings": 4,
              "x_m": 0.05,
              "width_m": 0.5,
              "height_m": 0.22
            },
            {
              "slot_id": "B1S3P2",
              "sku_id": null,
              "facings": 0,
              "x_m": 0.6,
              "width_m": 0.5,
              "height_m": 0.22
            }
          ]
        },
        {
          "shelf_id": "B1S4",
          "height_m": 0.85,
          "level": "below_eye",
          "slots": [
            {
              "slot_id": "B1S4P1",
              "sku_id": "SKU_006",
              "facings": 2,
              "x_m": 0.05,
              "width_m": 0.5,
              "height_m": 0.22
            },
            {
              "slot_id": "B1S4P2",
              "sku_id": "SKU_007",
              "facings": 3,
              "x_m": 0.6,
              "width_m": 0.5,
              "height_m": 0.22
            }
          ]
        },
        {
          "shelf_id": "B1S5",
          "height_m": 0.4,
          "level": "bottom",
          "slots": [
            {
              "slot_id": "B1S5P1",
              "sku_id": "SKU_008",
              "facings": 3,
              "x_m": 0.05,
              "width_m": 0.5,
              "height_m": 0.22
            },
            {
              "slot_id": "B1S5P2",
              "sku_id": null,
              "facings": 0,
              "x_m": 0.6,
              "width_m": 0.5,
              "height_m": 0.22
            }
          ]
        }
      ],
      "ad_slots": [
        {
          "ad_slot_id": "B1_TALKER",
          "type": "shelf_talker",
          "attached_to": "B1S3",
          "x_m": 0.4,
          "width_m": 0.3,
          "creative_id": null
        }
      ]
    },
    {
      "bay_id": "B2",
      "type": "shelf",
      "width_m": 1.2,
      "height_m": 1.8,
      "station": {
        "camera_pos": [
          1.5,
          1.5,
          2.2
        ],
        "look_at": [
          1.5,
          1.1,
          0.0
        ]
      },
      "shelves": [
        {
          "shelf_id": "B2S1",
          "height_m": 1.7,
          "level": "top",
          "slots": [
            {
              "slot_id": "B2S1P1",
              "sku_id": "SKU_009",
              "facings": 3,
              "x_m": 0.05,
              "width_m": 0.5,
              "height_m": 0.22
            },
            {
              "slot_id": "B2S1P2",
              "sku_id": "SKU_010",
              "facings": 4,
              "x_m": 0.6,
              "width_m": 0.5,
              "height_m": 0.22
            }
          ]
        },
        {
          "shelf_id": "B2S2",
          "height_m": 1.45,
          "level": "above_eye",
          "slots": [
            {
              "slot_id": "B2S2P1",
              "sku_id": "SKU_011",
              "facings": 4,
              "x_m": 0.05,
              "width_m": 0.5,
              "height_m": 0.22
            },
            {
              "slot_id": "B2S2P2",
              "sku_id": "SKU_012",
              "facings": 2,
              "x_m": 0.6,
              "width_m": 0.5,
              "height_m": 0.22
            }
          ]
        },
        {
          "shelf_id": "B2S3",
          "height_m": 1.2,
          "level": "eye",
          "slots": [
            {
              "slot_id": "B2S3P1",
              "sku_id": "SKU_013",
              "facings": 2,
              "x_m": 0.05,
              "width_m": 0.5,
              "height_m": 0.22
            },
            {
              "slot_id": "B2S3P2",
              "sku_id": null,
              "facings": 0,
              "x_m": 0.6,
              "width_m": 0.5,
              "height_m": 0.22
            }
          ]
        },
        {
          "shelf_id": "B2S4",
          "height_m": 0.85,
          "level": "below_eye",
          "slots": [
            {
              "slot_id": "B2S4P1",
              "sku_id": "SKU_014",
              "facings": 3,
              "x_m": 0.05,
              "width_m": 0.5,
              "height_m": 0.22
            },
            {
              "slot_id": "B2S4P2",
              "sku_id": "SKU_015",
              "facings": 4,
              "x_m": 0.6,
              "width_m": 0.5,
              "height_m": 0.22
            }
          ]
        },
        {
          "shelf_id": "B2S5",
          "height_m": 0.4,
          "level": "bottom",
          "slots": [
            {
              "slot_id": "B2S5P1",
              "sku_id": "SKU_016",
              "facings": 4,
              "x_m": 0.05,
              "width_m": 0.5,
              "height_m": 0.22
            },
            {
              "slot_id": "B2S5P2",
              "sku_id": null,
              "facings": 0,
              "x_m": 0.6,
              "width_m": 0.5,
              "height_m": 0.22
            }
          ]
        }
      ],
      "ad_slots": [
        {
          "ad_slot_id": "B2_DECAL",
          "type": "floor_decal",
          "attached_to": "B2",
          "x_m": 0.3,
          "width_m": 0.6,
          "creative_id": null
        }
      ]
    },
    {
      "bay_id": "B3",
      "type": "endcap",
      "width_m": 1.2,
      "height_m": 1.8,
      "station": {
        "camera_pos": [
          3.0,
          1.5,
          2.2
        ],
        "look_at": [
          3.0,
          1.1,
          0.0
        ]
      },
      "shelves": [
        {
          "shelf_id": "B3S1",
          "height_m": 1.7,
          "level": "top",
          "slots": [
            {
              "slot_id": "B3S1P1",
              "sku_id": "SKU_017",
              "facings": 4,
              "x_m": 0.05,
              "width_m": 0.5,
              "height_m": 0.22
            },
            {
              "slot_id": "B3S1P2",
              "sku_id": "SKU_018",
              "facings": 2,
              "x_m": 0.6,
              "width_m": 0.5,
              "height_m": 0.22
            }
          ]
        },
        {
          "shelf_id": "B3S2",
          "height_m": 1.45,
          "level": "above_eye",
          "slots": [
            {
              "slot_id": "B3S2P1",
              "sku_id": "SKU_019",
              "facings": 2,
              "x_m": 0.05,
              "width_m": 0.5,
              "height_m": 0.22
            },
            {
              "slot_id": "B3S2P2",
              "sku_id": "SKU_020",
              "facings": 3,
              "x_m": 0.6,
              "width_m": 0.5,
              "height_m": 0.22
            }
          ]
        },
        {
          "shelf_id": "B3S3",
          "height_m": 1.2,
          "level": "eye",
          "slots": [
            {
              "slot_id": "B3S3P1",
              "sku_id": "SKU_021",
              "facings": 3,
              "x_m": 0.05,
              "width_m": 0.5,
              "height_m": 0.22
            },
            {
              "slot_id": "B3S3P2",
              "sku_id": null,
              "facings": 0,
              "x_m": 0.6,
              "width_m": 0.5,
              "height_m": 0.22
            }
          ]
        },
        {
          "shelf_id": "B3S4",
          "height_m": 0.85,
          "level": "below_eye",
          "slots": [
            {
              "slot_id": "B3S4P1",
              "sku_id": "SKU_022",
              "facings": 4,
              "x_m": 0.05,
              "width_m": 0.5,
              "height_m": 0.22
            },
            {
              "slot_id": "B3S4P2",
              "sku_id": "SKU_023",
              "facings": 2,
              "x_m": 0.6,
              "width_m": 0.5,
              "height_m": 0.22
            }
          ]
        },
        {
          "shelf_id": "B3S5",
          "height_m": 0.4,
          "level": "bottom",
          "slots": [
            {
              "slot_id": "B3S5P1",
              "sku_id": "SKU_024",
              "facings": 2,
              "x_m": 0.05,
              "width_m": 0.5,
              "height_m": 0.22
            },
            {
              "slot_id": "B3S5P2",
              "sku_id": null,
              "facings": 0,
              "x_m": 0.6,
              "width_m": 0.5,
              "height_m": 0.22
            }
          ]
        }
      ],